Order,Question,A,B,C,D,answer
1,When David’s son Absalom rebelled against him, David was forced to,flee from Jerusalem,abdicate the throne,divide his kingdom,surrender to him,A
3,The last things which Zedekiah saw before his eyes were removed was the ,Egyptian army ,slaughter of all his sons ,city of Jerusalem ,feasting of the children of Israel ,B
4,Let his habitation be made desolate, and let there be no one to live in it’ who is being referred to here?  ,King soul ,Judas Iscariot ,Stephen ,Barnabas ,B
5,Joshua’s first victory was over the people of ,Ai ,Gideon ,Gilgal ,Jericho ,D
6,Peter admonished Christians to be sober and watchful in order to a void,temptation,God’s wrath,the devourer,damnation,A
7,“Test your servants for ten days; let us be given vegetables to eat and water to drink...” In the statement above, Daniel was talking to,King Darius,the chief of the eunuchs,the steward of the chief eunuch.,King Artaxerxes.,B
8,God’s constant love for unfaithful Israel is demonstrated in the book of ,Amos ,Isaiah ,Hosea ,Ezekiel,C
9,In Philippians, Paul taught that Jesus’humility and death on the cross earned Him ,salvation for Israel. ,adoption as son of Go ,exaltation as Lord,eternal life in the kingdom,C
10,Apart from the miracles at the wedding feast, another miracle of Jesus at Cana in Galilee was,feeding the four thousand.,healing the noble man’s son.,healing of a man born blind,healing a paralytic man.,D
11,True religion, according to Amos’ submission, is the one in which  ,God is always appeased with sacrifices and tithes ,Foods and drinks are served as a mark of love ,Justice and righteousness flows like an endless stream  ,Feast and solemn assemblies play important roles ,C
12,The two Old Testament books that were used in the temptation stories were,Genesis and Proverbs,Leviticus and Lamentation, Numbers and Ecclesiates,Deuteronomy and Psalms,D
13,The descent of the Holy Spirit on the day of  Pentecost was prophesied by ,Amos.           ,Joel.              , David,Ezekiel. ,B
14,The disciples of Jesus could not heal the boy with epilepsy because they,did not fast,had little faith,were powerless,did not pray.,A
15,Apart from the miracles at the wedding feast, another miracle of Jesus at Cana in Galilee was,feeding the four thousan    ,healing the noble man’s son.     ,healing of a man born blind,D   healing a paralytic man.,D
16,“The Lord forbid that I should give you the inheritance of my fathers”. The inheritance referred to here is,birth right.,the world.,the kingship.,a vineyard.,D
17,James advised Christians to portray their faith in Jesus by ,listening to the word of God always. ,converting others to Christ. ,practicalizing their Christian belief ,constant prayer and fasting,C
18,“Your father made our yoke heavy. Now therefore, lighten the hard service of your father.” These were the words of,Jeroboam,Solomon,.         
David,Ahijah.,A
19,Where did Paul cure a slave girl who had a spirit of divination ,Philippi ,Ephesus ,Athens ,Antioch,A
20,Paul taught the Colossians that the relationship between wives and their husbands should be as,is fitting in the Lord,the culture demands,is written in the law,the husband commands,A
21,“Shall l pursue after this band? Shall l overtake them?” David’s dependence on God for direction is depicted in the statement above when,Absalom had revolted against him,Saul was within his grasp,the Amalekites had raided Ziklag,he was to go against Goliath,C
22,Paul, in Romans, taught that Christians are Abraham’s descendants by,grace,faith,circumcision,law,B
23,The Pharisees and the Scribes accused the disciples of Jesus transgressing the tradition of the elders because they ,did not regard synagogue rules ,did not pray before meals ,ate with unwashed hands ,disobeyed the elders,C
24,When Ezekiel ate the scroll that was given to him his call. it signified that,God would always go before him,his sins were forgiven,he would never be hungry,he was filled with God’s word,D
25,God’s constant love for unfaithful Israel is demonstrated in the book of,Amos,Isaiah,Hosea,Ezekiel,C
26,James maintained that the double-minded man would not have his prayers answered because he,is unstable in all his ways,asks for things with selfish motives,prays with unforgiving hearts,intercedes with a sinful heart,A
27,The tribes which lead the Jews in rebuilding the temple were,Judah and Benjamin, Levi and Gad,Ephraim and Manasseh,Reuben and Zebulum,A
28,Yet what they are building if a fox goes up on it he will breakdown their stone wall”. This statement by Tobias was ,taunt and ridicule the Jews,stop and disgrace the Jews,tease and punish Nehemiah.,alert and strengthen Nehemiah,A
29,Amram and Jochebad gave birth to : ,Mirian ,Jedida ,Jethro ,Hur,A
30,In Philippians, Paul taught that Jesus ‘humility and death on the cross earned Him,salvation for Israel.,adoption as son of God.,exaltation as Lord.,eternal life in the kingdom.,C
31,The treasures which Jesus wants us to lay in heaven include,generosity and kindness.,love and mercy.,works of righteousness,gold and silver.,C
32,The incident in the fiery furnace concerning Shadrach, Meshach and Abednego convinced Nebuchadnezzar that, they had many gods to save them. ,the Jews were very powerful people. ,the three Jews were angelic beings,Yahweh is the only true God.,D
33,According to Peter, Christians who suffer for Christ should not be ashamed but should,glorify God.,be encouraged.,be patient.,be grateful.,B
34,One of the following said: “the lion has roared who will not fear? ,Nathan ,Jeremiah ,Amos ,Hosea,A
35,Apart from the miracles at the wedding feast, another miracle of Jesus at Cana in Galilee was,feeding the four thousan    ,healing the noble man’s son.     ,healing of a man born blind,D   healing a paralytic man.,D
36,How old was Abram when God appeared to him the second time?,105 years,75 years,99 years,85 years,C
37,Peter called for the construction of three booths for Jesus, Moses and Elijah, respectively during ,the transfiguration. ,the Ascension. ,Jesus’arrest. ,the passover feast.,A
38,Apart from the miracles at the wedding feast, another miracle of Jesus at Cana in Galilee was,feeding the four thousan    ,healing the noble man’s son.     ,healing of a man born blind,D   healing a paralytic man.,D
39,“This is the King of the Jews”This inscription on the cross was meant to show Jesus,charge ,punishment ,victory       ,messiaship,A
40,The concept of  forgiveness does not include,reconciliation,restoration,peace,wealth,D
41,In Philippians, Paul taught that Jesus’humility and death on the cross earned Him ,salvation for Israel. ,adoption as son of Go ,exaltation as Lord,eternal life in the kingdom,C
42,Paul in Romans advised believers to respect those in authority to avoid God’s wrath and also for the sake of,conscience,Christ,faith,others,A
43,One of the following said: “the lion has roared who will not fear? ,Nathan ,Jeremiah ,Amos ,Hosea,A
44,To whom was the body of Jesus Christ given for burial after His death? ,Nicodemus the Pharisee ,Simon of Cyrene ,Simon the disciple ,Joseph of Arimathea.,B
45,“Dress yourself and put on your sandals”. Obedience to this instruction led to ,an angel’s destruction of Herod ,Peter’s arrest and imprisonment ,Peter’s release from prison ,the disciples’escape from Herod,C
46,Before their first encounter with Jesus, Peter and Andrew were,preachers.,tax collectors.,fishermen.,tent makers.,C
47,Deborah was a judge when Israel was under the yoke of ,Moab ,Midian ,Canaan ,Philistine,C
48,Who do people say the son of man is? Jesus asks this question to know people’s ,desires ,demand  ,mind ,opinion,C
49,True religion, according to Amos’ submission, is the one in which  ,God is always appeased with sacrifices and tithes ,Foods and drinks are served as a mark of love ,Justice and righteousness flows like an endless stream  ,Feast and solemn assemblies play important roles ,C
50,The incident in the fiery furnace concerning Shadrach, Meshach and Abednego convinced Nebuchadnezzar that, they had many gods to save them. ,the Jews were very powerful people. ,the three Jews were angelic beings,Yahweh is the only true God.,D
51,What shall I do with you, O Ephraim? What shall I do with you, O Judah? Your love is like a morning cloud...” In the statement above, the love of Israel is compared to a morning cloud because it,disappears fast,withers,is cloudy,darkens the day,A
52,In Philippians, Paul taught that Jesus’humility and death on the cross earned Him ,salvation for Israel. ,adoption as son of Go ,exaltation as Lord,eternal life in the kingdom,C
53,The promise to those who are persecuted for righteousness sake is that they will,inherit the earth,inherit the kingdom of heaven,see God,be called sons of God.,B
54,Paul in Romans advised believers to respect those in authority to avoid God’s wrath and also for the sake of,conscience,Christ,faith,others,A
55,The eunuch who went to Jerusalem to worship in Acts 8:27 was a  ,minister of God  ,minister of Candace the queen Gaza  ,minister of Candace the king of the Ethiopians,minister of Candace the queen of the Ethiopians,D
56,The primary motive for Christian giving is to,go to heaven when they die,reciprocate God’s blessing.,support the work of the church.,provide for the servants of God,B
57,The treasures which Jesus wants us to lay in heaven include,generosity and kindness.,love and mercy.,works of righteousness,gold and silver.,C
58,Peter admonished church leaders to take care of the flock of Christ in order to,restrain men from degrading the church ,obtain God’s crown of glory ,build a vibrant church ,ensure discipline in the church,B
59,The wife of Moses was called,Rebecca.,Rachel.,Zipporah.,Deborah,C
60,In spite of Solomon’s apostasy, his empire remained intact until his death because ,God deferred, for David’s sake, the punishment due to him, he won decisive victories over his enemies. ,he always took wise decisions,he made surrounding nations fight among themselves.,A
61,The disciples of Jesus could not heal the boy with epilepsy because they,did not fast,had little faith,were powerless,did not pray.,A
62,When Ezekiel ate the scroll that was given to him his call. it signified that,God would always go before him,his sins were forgiven,he would never be hungry,he was filled with God’s word,D
63,According to Paul in his letter to Philemon, forgiveness should not be by compulsion but by,justification,faith,free will,His grace.,B
64,Those bitten by the serpent were treated by ,Drinking from the Red sea ,fasting for seven day ,looking at the bronze serpent ,call upon the lord ,C
65,In Peter’s teaching,” God…………..the proud and gives grace to the humble,receives ,relegates ,resists ,restores.,C
66,What specific reply did John the Baptist give to the soldiers during his preaching ,collect no more than is appointed you ,do not begin to say to yourselves: we have Abraham as our father ,bear fruits that befit repentance ,be content with your wages,D
67,Why according to Paul must Christians be subject to civil authority?,To receive God’s approval,To avoid God’s wrath,God has commanded it,It is an Old Testament law,B
68,When David’s son Absalom rebelled against him, David was forced to,flee from Jerusalem,abdicate the throne,divide his kingdom,surrender to him,A
69,True religion, according to Amos’ submission, is the one in which  ,God is always appeased with sacrifices and tithes ,Foods and drinks are served as a mark of love ,Justice and righteousness flows like an endless stream  ,Feast and solemn assemblies play important roles ,C
70,Why according to Paul must Christians be subject to civil authority?,To receive God’s approval,To avoid God’s wrath,God has commanded it,It is an Old Testament law,B
71,How old was Abram when God appeared to him the second time? ,75 years         ,85 years        ,99 years      ,105 years,C
72,On matters of parental responsibility, Samuel could not be commended because he,made his children judges instead of priests.,wanted his children to succeed him.,did nothing to stop his children’s immoral behaviours.,did not care what happened to Israel after his death.,C
73,“This is the King of the Jews”This inscription on the cross was meant to show Jesus,charge ,punishment ,victory       ,messiaship,A
74,According to Peter, Christians who suffer for Christ should not be ashamed but should,glorify God.,be encouraged.,be patient.,be grateful.,B
75,Nehemiah showed concern for this nation by,reviving Yahweh worship,rebuilding the temple,reconstructing Jerusalem walls,leading exiles home,C
76,Isaiah said that when Israel spread forth their hands, God would hide his face because they were,making many prayers,offering vain sacrifices.,worshipping God with their hearts.,observing elaborate feasts.,B
77,“...but should write to them to abstain from the pollutions of idols and from unchastity and from what is strangled and from blood...” The statement above was made at the Council of Jerusalem by,Philip,Simon,James,Peter,D
78,The miracles of Jesus recorded in John’s gospel are called,works,signs,powers,wonders.,B
79,“Your father made our yoke heavy. Now therefore, lighten the hard service of your father.” These were the words of,Jeroboam,Solomon,.         
David,Ahijah.,A
80,According to Paul, before his conversion, he persecuted the church violently to,make it desirable to the Gentiles,purge it,destroy it,have it conform to the Law.,D
81,According to James, treatment of brethren at fellowship should not be based on,appearance,sentiments,gender,age.,A
82,In Peter’s teaching,” God…………..the proud and gives grace to the humble,receives ,relegates ,resists ,restores.,C
83,The book of ____ mostly emphasized social justice,Amos   ,Ezekiel   ,Hoshea,Isaiah,A
84,Paul, in Romans, taught that Christians are Abraham’s descendants by,grace,faith,circumcision,law,B
85,According to Paul in Corinthians the gospel message could only be lifeless when Christians ,deny the resurrection message.    ,persecute one another. ,gossip among themselves. ,entertain idolatrous practices,A
86,In his comparison of the human body with the body of Christ, Paul did not mention the ,han,foot. ,eye. ,nose.,D
87,Immediately after the contest on Mount Carmel, Elijah prayed and God answered him with,thunder,rainfall,a whirlwind,a heavy storm.,A
88,The sun stood still when ,Moses led Israel across the Red sea ,Jericho fell to the army of Joshua ,Noah came out of the ark ,Joshua defeated the Amorite at Gideon ,D
89,The two Old Testament books that were used in the temptation stories were,Genesis and Proverbs,Leviticus and Lamentation, Numbers and Ecclesiates,Deuteronomy and Psalms,D
90,“Shall l pursue after this band? Shall l overtake them?” David’s dependence on God for direction is depicted in the statement above when,Absalom had revolted against him,Saul was within his grasp,the Amalekites had raided Ziklag,he was to go against Goliath,C
91,Manahem, the son of Gadi reigned over Israel for ,eight years ,twenty years ,six month ,ten years.,D
92,Render to Caesar the things that they are Caesar’s and to God the things are God’s, the above quotation emphasizes  ,Obedience to divine authority  ,Striking a balance between civil and divine authorities ,Disobedience to civil authority  ,Total rejection of both divine and civil authorities,B
93,In Philippians, Paul taught that Jesus’humility and death on the cross earned Him ,salvation for Israel. ,adoption as son of Go ,exaltation as Lord,eternal life in the kingdom,C
94,What virtue did the Centurion exhibit in the healing of his servant?,Forgiveness    ,Love       ,Compassion      ,Faith,D
95,When God called Moses to deliver the Israelites, he resisted because he could not speak and he was told to,perform some signs with his rod,wait for a sign from God,go with Joshua who would speak for him,go with Aaron who would speak for him,D
96,In his comparison of the human body with the body of Christ, Paul did not mention the,hand.,foot.,eye.,nose.,D
97,God blessed and hallowed the seventh day because,it was the day He rested from creation,it was the day He created man,He wanted it to be a day of worship,He saw that all He had created was good.,A
98,The Pharisees and the Scribes accused the disciples of Jesus transgressing the tradition of the elders because they ,did not regard synagogue rules ,did not pray before meals ,ate with unwashed hands ,disobeyed the elders,C
99,Immediately after the contest on Mount Carmel, Elijah prayed and God answered him with,thunder,rainfall,a whirlwind,a heavy storm.,A
100,“...but should write to them to abstain from the pollutions of idols and from unchastity and from what is strangled and from blood...” The statement above was made at the Council of Jerusalem by,Philip,Simon,James,Peter,D
